{
  "schemaVersion": "1.0",
  "task": { "name": "m9-vm-dll-dependency", "mode": "create", "vmVersion": "4.4.0" },
  "scripts": [
    {
      "id": "netdxf-script",
      "carrier": "csharp-module",
      "name": "DLL引用验证",
      "procedure": "流程1",
      "source": "using System;\nusing Script.Methods;\npublic partial class UserScript : ScriptMethods, IProcessMethods\n{\n    public void Init() { }\n    public bool Process() { return true; }\n}\n",
      "execution": { "mode": "once", "order": 0 },
      "inputs": [],
      "outputs": [],
      "operations": [],
      "dependencies": [
        { "kind": "dotnet-assembly", "name": "netDxf.dll", "architecture": "anycpu" }
      ]
    }
  ],
  "connections": []
}
