{
  "schemaVersion": "1.0",
  "task": { "name": "m10-output-only-csharp", "mode": "create", "vmVersion": "4.4.0" },
  "scripts": [
    {
      "id": "output-only",
      "carrier": "csharp-module",
      "name": "仅输出脚本",
      "procedure": "流程1",
      "execution": { "mode": "once", "order": 0 },
      "inputs": [],
      "outputs": [{ "name": "Result", "type": "int" }],
      "operations": [{ "kind": "setOutput", "parameter": "Result", "value": 42 }],
      "dependencies": []
    }
  ],
  "connections": []
}
