{
  "schemaVersion": "1.0",
  "task": {
    "name": "csharp-sum-example",
    "mode": "create",
    "vmVersion": "4.4.0"
  },
  "scripts": [
    {
      "id": "sum-csharp",
      "carrier": "csharp-module",
      "name": "CSharp求和",
      "procedure": "流程1",
      "execution": {
        "mode": "once",
        "order": 0
      },
      "inputs": [
        { "name": "A", "type": "int", "default": 2, "required": true },
        { "name": "B", "type": "int", "default": 5, "required": true }
      ],
      "outputs": [
        { "name": "Sum", "type": "int", "default": 0 }
      ],
      "operations": [
        {
          "kind": "setOutput",
          "parameter": "Sum",
          "value": {
            "kind": "binary",
            "operator": "add",
            "left": { "kind": "input", "name": "A" },
            "right": { "kind": "input", "name": "B" }
          }
        }
      ],
      "dependencies": []
    }
  ],
  "connections": []
}
